{
  "run_id": "<YOUR_RUN_ID>",
  "input_csv": "<path/to/input.csv>",
  "field_meta_csv": "<path/to/field_meta.csv or null>",
  "target": "is_bad",
  "id_col": "apply_id",
  "time_col": "apply_month",
  "exclude_cols": ["is_bad", "apply_id", "apply_month"],
  "feature_cols": null,
  "special_values": {},
  "test_ratio": 0.2,
  "oot_ratio": 0.1,
  "oot_months": 3,
  "random_state": 42,
  "bins": 10,
  "max_levels": 20,
  "psi_stable_threshold": 0.1,
  "psi_watch_threshold": 0.25,
  "tree_max_depth": 3,
  "tree_min_samples_leaf": 0.03,
  "tree_min_samples_split": 0.06,
  "rule_min_hit_rate": 0.01,
  "rule_min_bad_count": 10,
  "rule_min_lift": 1.5,
  "combo_max_size": 2,
  "combo_top_n": 20,
  "rejected_lift": 1.5,
  "segment_col": null,
  "segment_lift_map": null,
  "max_reject_rate": 0.2,
  "max_pass_bad_rate": null,
  "output_dir": "runs/<YOUR_RUN_ID>"
}
